{
  "schema_version": 3,
  "discovery_policy": {
    "default_source_order": [
      "skills-sh",
      "plugin-marketplace",
      "github",
      "installed",
      "bundled",
      "plugin"
    ],
    "professional_source_domains": [
      "dart.dev",
      "flutter.dev",
      "docs.flutter.dev",
      "pub.dev",
      "serverpod.dev",
      "dartfrog.vgv.dev",
      "clerk.com",
      "auth0.com",
      "openid.net",
      "oauth.net",
      "docs.sentry.io",
      "supabase.com",
      "postgresql.org",
      "docs.stripe.com",
      "stripe.com",
      "docs.paddle.com",
      "adyen.com",
      "pcisecuritystandards.org",
      "posthog.com",
      "amplitude.com",
      "segment.com",
      "snowplow.io",
      "rudderstack.com",
      "mixpanel.com",
      "docs.djangoproject.com",
      "rubyonrails.org",
      "spring.io",
      "nodejs.org",
      "expressjs.com",
      "fastify.dev",
      "nestjs.com",
      "go.dev",
      "kotlinlang.org",
      "developer.android.com",
      "developer.apple.com",
      "react.dev",
      "nextjs.org",
      "vite.dev",
      "playwright.dev",
      "owasp.org",
      "opentelemetry.io",
      "martinfowler.com",
      "12factor.net",
      "learn.microsoft.com",
      "docs.aws.amazon.com",
      "cloud.google.com"
    ],
    "specialized_platform_domains": [
      "pub.dev",
      "github.com",
      "skills.sh",
      "npmjs.com",
      "pkg.go.dev",
      "crates.io"
    ],
    "trusted_github_orgs": [
      "dart-lang",
      "flutter",
      "serverpod",
      "verygoodopensource",
      "supabase",
      "getsentry",
      "OWASP",
      "open-telemetry",
      "django",
      "rails",
      "spring-projects",
      "expressjs",
      "fastify",
      "nestjs",
      "vercel"
    ],
    "query_expansions": {
      "auth": [
        "authentication architecture",
        "oauth oidc best practices",
        "session management security",
        "authorization rbac abac",
        "account recovery security",
        "identity provider integration testing"
      ],
      "authentication": [
        "authentication architecture",
        "oauth oidc best practices",
        "session management security",
        "authorization rbac abac",
        "account recovery security",
        "identity provider integration testing"
      ],
      "dart": [
        "effective dart",
        "dart analyzer lints",
        "dart package design",
        "dart clean architecture",
        "dart domain driven design",
        "dart property based testing",
        "dart mutation testing",
        "dart static analysis",
        "dart isolates concurrency"
      ],
      "flutter": [
        "flutter architecture",
        "flutter performance best practices",
        "flutter accessibility",
        "flutter testing",
        "flutter state management",
        "flutter offline first"
      ],
      "backend": [
        "backend clean architecture",
        "backend domain driven design",
        "backend hexagonal architecture",
        "api design guidelines",
        "contract testing",
        "owasp api security",
        "opentelemetry observability",
        "twelve factor app"
      ],
      "product-analytics": [
        "product analytics event taxonomy",
        "analytics instrumentation plan",
        "privacy safe product analytics",
        "funnel analysis best practices",
        "experimentation guardrails",
        "analytics data quality testing"
      ],
      "analytics": [
        "product analytics event taxonomy",
        "analytics instrumentation plan",
        "privacy safe product analytics",
        "funnel analysis best practices",
        "experimentation guardrails",
        "analytics data quality testing"
      ],
      "finance-transactions": [
        "payment integration idempotency",
        "ledger reconciliation patterns",
        "financial transaction testing",
        "payment webhook reliability",
        "refund dispute handling",
        "pci compliance developer guide"
      ],
      "payments": [
        "payment integration idempotency",
        "ledger reconciliation patterns",
        "financial transaction testing",
        "payment webhook reliability",
        "refund dispute handling",
        "pci compliance developer guide"
      ],
      "ledger": [
        "ledger reconciliation patterns",
        "double entry accounting software",
        "transaction audit trail",
        "financial consistency model"
      ],
      "api-design": [
        "rest api design",
        "openapi contract",
        "api versioning",
        "idempotency",
        "pagination patterns"
      ],
      "testing": [
        "test driven development",
        "contract testing",
        "property based testing",
        "mutation testing",
        "integration testing"
      ],
      "security": [
        "owasp top 10",
        "owasp api security",
        "threat modeling",
        "secure coding guidelines"
      ],
      "observability": [
        "opentelemetry",
        "structured logging",
        "distributed tracing",
        "sli slo"
      ]
    },
    "source_quality_weights": {
      "professional_domain": 8,
      "specialized_platform": 5,
      "trusted_github_org": 4,
      "external_index": 3,
      "installed_local": 1
    }
  },
  "application_blocks": {
    "auth": {
      "surface": "auth-identity",
      "aliases": ["auth", "authentication", "identity", "login", "signup", "oauth", "oidc", "sessions", "authorization"]
    },
    "authentication": {
      "canonical": "auth",
      "surface": "auth-identity",
      "aliases": ["auth", "authentication", "identity", "login", "signup", "oauth", "oidc", "sessions", "authorization"]
    },
    "product-analytics": {
      "surface": "product-analytics",
      "aliases": ["analytics", "product analytics", "events", "funnels", "metrics", "experimentation", "tracking"]
    },
    "analytics": {
      "canonical": "product-analytics",
      "surface": "product-analytics",
      "aliases": ["analytics", "product analytics", "events", "funnels", "metrics", "experimentation", "tracking"]
    },
    "finance-transactions": {
      "surface": "finance-transactions",
      "aliases": ["finance", "financial", "transactions", "payments", "billing", "subscriptions", "ledger", "reconciliation", "refunds", "invoicing"]
    },
    "payments": {
      "canonical": "finance-transactions",
      "surface": "finance-transactions",
      "aliases": ["finance", "financial", "transactions", "payments", "billing", "subscriptions", "ledger", "reconciliation", "refunds", "invoicing"]
    }
  },
  "surfaces": {
    "backend": {
      "description": "Server-side product capability: APIs, data, auth, integration boundaries, reliability, and security.",
      "default_aspects": [
        "api-design",
        "architecture",
        "database",
        "auth",
        "security",
        "observability",
        "testing",
        "performance"
      ],
      "tech_match": [
        "node",
        "express",
        "fastify",
        "nestjs",
        "dart",
        "shelf",
        "serverpod",
        "dart-frog",
        "fastapi",
        "django",
        "rails",
        "spring",
        "go",
        "rust",
        "postgres",
        "mysql",
        "redis",
        "prisma",
        "supabase",
        "graphql",
        "rest",
        "queue",
        "kafka"
      ],
      "capability_packs": [
        "api-contracts",
        "backend-architecture",
        "database-performance",
        "auth-security",
        "observability",
        "backend-testing"
      ],
      "aspect_capability_packs": {
        "api-design": ["api-contracts"],
        "architecture": ["backend-architecture", "api-contracts"],
        "database": ["database-performance"],
        "auth": ["auth-security"],
        "security": ["auth-security"],
        "observability": ["observability"],
        "testing": ["backend-testing"],
        "performance": ["database-performance", "observability"]
      },
      "aspect_aliases": {
        "api-design": ["api design", "rest api", "openapi", "contract first", "api versioning", "idempotency", "pagination"],
        "architecture": ["clean architecture", "hexagonal architecture", "domain driven design", "layered architecture", "twelve factor app", "effective dart", "dart package design"],
        "database": ["data modeling", "schema design", "query optimization", "indexes", "transactions"],
        "auth": ["authentication", "authorization", "session management", "jwt", "oauth"],
        "security": ["owasp", "owasp api security", "threat modeling", "secure coding"],
        "observability": ["opentelemetry", "structured logging", "distributed tracing", "sli", "slo"],
        "testing": ["test driven development", "contract testing", "integration testing", "property based testing", "mutation testing"],
        "performance": ["caching", "profiling", "latency", "throughput", "load testing"]
      },
      "aspect_profiles": [
        {
          "tech_match": ["postgres", "mysql", "redis", "prisma", "supabase"],
          "aspects": ["architecture", "database", "auth", "security", "observability", "testing", "performance"]
        },
        {
          "tech_match": ["queue", "kafka"],
          "aspects": ["api-design", "architecture", "observability", "testing", "performance"]
        },
        {
          "tech_match": ["graphql", "rest", "node", "express", "fastify", "nestjs", "fastapi", "django", "rails", "spring", "go", "rust", "dart", "shelf", "serverpod", "dart-frog"],
          "aspects": ["api-design", "architecture", "auth", "security", "observability", "testing", "performance"]
        }
      ]
    },
    "auth-identity": {
      "description": "Authentication and identity capability: login, signup, sessions, OAuth/OIDC, authorization, account recovery, privacy, and abuse boundaries.",
      "default_aspects": [
        "identity-model",